{
  "work_id": "WORK-001",
  "title": "Pilot Novel",
  "authors": [
    "Author Name"
  ],
  "copyright_owners": [
    "Author Name"
  ],
  "publishing_rights_holders": [
    "Author Name"
  ],
  "publication_authority": "Author Name",
  "territories": [
    "Worldwide"
  ],
  "languages": [
    "English"
  ],
  "formats": [
    "print",
    "ebook"
  ],
  "prior_publication": {
    "exists": false
  },
  "prior_assignment": {
    "exists": false,
    "resolved": true
  },
  "rights_status": "cleared"
}
